{
  "schema_version": "scoreboard-0.1",
  "run_id": "baseline-example-2026-06-18",
  "timestamp": "2026-06-18T09:00:00+00:00",
  "wsl_commit": "abc1234",
  "git_commit": "abc1234",
  "wsl_dirty": false,
  "branch": "codex/issue-87-readiness",
  "jetson_install_sha": "abc1234",
  "jetson_deploy_ts": "2026-06-18T08:30:00+00:00",
  "jetson_sync_method": "rsync",
  "jetson_dirty": false,
  "manifest_exists": true,
  "version_mismatch": false,
  "version_stale": false,
  "layer0_preflight_status": "pass",
  "run_trusted": true,
  "demo_profile_env": {},
  "capabilities": {
    "face.recognition": {
      "capability_id": "face.recognition",
      "grade": "pass",
      "sample_count": 3,
      "success_rate": 1.0,
      "false_trigger_rate": 0.0,
      "latency_p50": 120.0,
      "latency_p90": 180.0,
      "confirmed": true,
      "positive_count": 3,
      "idle_count": 2,
      "registered_recall": 1.0,
      "unknown_false_accept_rate": 0.0,
      "wrong_person_count": 0,
      "claim_level": "mainline",
      "risk_role": "evidence_only",
      "depth": "deep",
      "dependency_role": "content",
      "brain_allowed": true
    },
    "voice.command": {
      "capability_id": "voice.command",
      "grade": "pass",
      "sample_count": 3,
      "success_rate": 1.0,
      "false_trigger_rate": 0.0,
      "latency_p50": 250.0,
      "latency_p90": 360.0,
      "confirmed": true,
      "positive_count": 3,
      "idle_count": 2,
      "registered_recall": 1.0,
      "unknown_false_accept_rate": 0.0,
      "wrong_person_count": 0,
      "claim_level": "mainline",
      "risk_role": "convenience",
      "depth": "deep",
      "dependency_role": "trigger",
      "brain_allowed": true
    },
    "voice.stop": {
      "capability_id": "voice.stop",
      "grade": "pass",
      "sample_count": 3,
      "success_rate": 1.0,
      "false_trigger_rate": 0.0,
      "latency_p50": 220.0,
      "latency_p90": 340.0,
      "confirmed": true,
      "positive_count": 3,
      "idle_count": 2,
      "registered_recall": 1.0,
      "unknown_false_accept_rate": 0.0,
      "wrong_person_count": 0,
      "claim_level": "mainline",
      "risk_role": "convenience",
      "depth": "deep",
      "dependency_role": "trigger",
      "brain_allowed": true
    },
    "gesture.wave": {
      "capability_id": "gesture.wave",
      "grade": "pass",
      "sample_count": 3,
      "success_rate": 1.0,
      "false_trigger_rate": 0.0,
      "latency_p50": 100.0,
      "latency_p90": 150.0,
      "confirmed": true,
      "positive_count": 3,
      "idle_count": 2,
      "registered_recall": 1.0,
      "unknown_false_accept_rate": 0.0,
      "wrong_person_count": 0,
      "claim_level": "mainline",
      "risk_role": "convenience",
      "depth": "deep",
      "dependency_role": "trigger",
      "brain_allowed": true
    },
    "object.cup": {
      "capability_id": "object.cup",
      "grade": "pass",
      "sample_count": 3,
      "success_rate": 1.0,
      "false_trigger_rate": 0.0,
      "latency_p50": 140.0,
      "latency_p90": 210.0,
      "confirmed": true,
      "positive_count": 3,
      "idle_count": 2,
      "registered_recall": 1.0,
      "unknown_false_accept_rate": 0.0,
      "wrong_person_count": 0,
      "claim_level": "mainline",
      "risk_role": "evidence_only",
      "depth": "deep",
      "dependency_role": "content",
      "brain_allowed": true
    },
    "nav.safe_stop": {
      "capability_id": "nav.safe_stop",
      "grade": "pass",
      "sample_count": 3,
      "success_rate": 1.0,
      "false_trigger_rate": 0.0,
      "latency_p50": 80.0,
      "latency_p90": 120.0,
      "confirmed": true,
      "positive_count": 3,
      "idle_count": 2,
      "registered_recall": 1.0,
      "unknown_false_accept_rate": 0.0,
      "wrong_person_count": 0,
      "claim_level": "mainline",
      "risk_role": "safety_critical",
      "depth": "deep",
      "dependency_role": "safety_guard",
      "brain_allowed": true
    },
    "nav.no_auto_resume": {
      "capability_id": "nav.no_auto_resume",
      "grade": "pass",
      "sample_count": 3,
      "success_rate": 1.0,
      "false_trigger_rate": 0.0,
      "latency_p50": 90.0,
      "latency_p90": 130.0,
      "confirmed": true,
      "positive_count": 3,
      "idle_count": 2,
      "registered_recall": 1.0,
      "unknown_false_accept_rate": 0.0,
      "wrong_person_count": 0,
      "claim_level": "mainline",
      "risk_role": "safety_critical",
      "depth": "deep",
      "dependency_role": "safety_guard",
      "brain_allowed": true
    },
    "nav.short_move": {
      "capability_id": "nav.short_move",
      "grade": "pass",
      "sample_count": 3,
      "success_rate": 1.0,
      "false_trigger_rate": 0.0,
      "latency_p50": 160.0,
      "latency_p90": 230.0,
      "confirmed": true,
      "positive_count": 3,
      "idle_count": 2,
      "registered_recall": 1.0,
      "unknown_false_accept_rate": 0.0,
      "wrong_person_count": 0,
      "claim_level": "mainline",
      "risk_role": "actuation",
      "depth": "deep",
      "dependency_role": "actuation",
      "brain_allowed": true
    },
    "nav.dynamic_avoidance": {
      "capability_id": "nav.dynamic_avoidance",
      "grade": "insufficient_data",
      "sample_count": 0,
      "success_rate": null,
      "false_trigger_rate": null,
      "latency_p50": null,
      "latency_p90": null,
      "confirmed": false,
      "positive_count": 0,
      "idle_count": 0,
      "registered_recall": null,
      "unknown_false_accept_rate": null,
      "wrong_person_count": 0,
      "claim_level": "future",
      "risk_role": "actuation",
      "depth": "future",
      "dependency_role": "actuation",
      "brain_allowed": false,
      "failure_reason": "future capability not claimed in baseline"
    },
    "pose.basic": {
      "capability_id": "pose.basic",
      "grade": "pass",
      "sample_count": 3,
      "success_rate": 1.0,
      "false_trigger_rate": 0.0,
      "latency_p50": 110.0,
      "latency_p90": 170.0,
      "confirmed": true,
      "positive_count": 3,
      "idle_count": 2,
      "registered_recall": 1.0,
      "unknown_false_accept_rate": 0.0,
      "wrong_person_count": 0,
      "claim_level": "studio_only",
      "risk_role": "evidence_only",
      "depth": "thin",
      "dependency_role": "content",
      "brain_allowed": false
    },
    "pose.fall": {
      "capability_id": "pose.fall",
      "grade": "insufficient_data",
      "sample_count": 0,
      "success_rate": null,
      "false_trigger_rate": null,
      "latency_p50": null,
      "latency_p90": null,
      "confirmed": false,
      "positive_count": 0,
      "idle_count": 0,
      "registered_recall": null,
      "unknown_false_accept_rate": null,
      "wrong_person_count": 0,
      "claim_level": "future",
      "risk_role": "evidence_only",
      "depth": "future",
      "dependency_role": "evidence",
      "brain_allowed": false,
      "failure_reason": "future capability not claimed in baseline"
    },
    "brain.skill_gate": {
      "capability_id": "brain.skill_gate",
      "grade": "pass",
      "sample_count": 3,
      "success_rate": 1.0,
      "false_trigger_rate": 0.0,
      "latency_p50": 70.0,
      "latency_p90": 100.0,
      "confirmed": true,
      "positive_count": 3,
      "idle_count": 2,
      "registered_recall": 1.0,
      "unknown_false_accept_rate": 0.0,
      "wrong_person_count": 0,
      "claim_level": "mainline",
      "risk_role": "safety_critical",
      "depth": "deep",
      "dependency_role": "safety_guard",
      "brain_allowed": true
    },
    "brain.trace": {
      "capability_id": "brain.trace",
      "grade": "pass",
      "sample_count": 3,
      "success_rate": 1.0,
      "false_trigger_rate": 0.0,
      "latency_p50": 50.0,
      "latency_p90": 80.0,
      "confirmed": true,
      "positive_count": 3,
      "idle_count": 2,
      "registered_recall": 1.0,
      "unknown_false_accept_rate": 0.0,
      "wrong_person_count": 0,
      "claim_level": "mainline",
      "risk_role": "evidence_only",
      "depth": "deep",
      "dependency_role": "evidence",
      "brain_allowed": true
    },
    "studio.evidence": {
      "capability_id": "studio.evidence",
      "grade": "pass",
      "sample_count": 3,
      "success_rate": 1.0,
      "false_trigger_rate": 0.0,
      "latency_p50": 60.0,
      "latency_p90": 90.0,
      "confirmed": true,
      "positive_count": 3,
      "idle_count": 2,
      "registered_recall": 1.0,
      "unknown_false_accept_rate": 0.0,
      "wrong_person_count": 0,
      "claim_level": "mainline",
      "risk_role": "evidence_only",
      "depth": "deep",
      "dependency_role": "evidence",
      "brain_allowed": true
    },
    "cli.readiness": {
      "capability_id": "cli.readiness",
      "grade": "pass",
      "sample_count": 3,
      "success_rate": 1.0,
      "false_trigger_rate": 0.0,
      "latency_p50": 30.0,
      "latency_p90": 50.0,
      "confirmed": true,
      "positive_count": 3,
      "idle_count": 2,
      "registered_recall": 1.0,
      "unknown_false_accept_rate": 0.0,
      "wrong_person_count": 0,
      "claim_level": "not_claimed",
      "risk_role": "safety_support",
      "depth": "thin",
      "dependency_role": "evidence",
      "brain_allowed": false
    }
  }
}
