{
  "schema_version": "scoreboard-0.1",
  "run_id": "d8f7e800-18f4-4600-80c3-157dfda72975",
  "timestamp": "2026-06-03T06:49:40.049762+00:00",
  "wsl_commit": "2e00914",
  "wsl_dirty": true,
  "branch": "main",
  "jetson_install_sha": "2e00914cd8eeef869664c8ed9acea681f237a39a",
  "jetson_deploy_ts": "2026-06-03T06:24:20.519262+00:00",
  "jetson_sync_method": "sync-once",
  "jetson_dirty": true,
  "manifest_exists": true,
  "version_mismatch": false,
  "version_stale": false,
  "layer0_preflight_status": "pass",
  "run_trusted": true,
  "demo_profile_env": {},
  "capabilities": {
    "face.recognition": {
      "capability_id": "face.recognition",
      "grade": "fail",
      "sample_count": 3,
      "success_rate": 0.333,
      "false_trigger_rate": 0.333,
      "latency_p50": 313.42053413391113,
      "latency_p90": 313.42053413391113,
      "confirmed": true,
      "positive_count": 2,
      "idle_count": 1,
      "registered_recall": 0.5,
      "unknown_false_accept_rate": 1.0,
      "wrong_person_count": 0,
      "claim_level": "mainline",
      "risk_role": "evidence_only",
      "depth": "deep",
      "dependency_role": "content",
      "brain_allowed": false
    },
    "voice.command": {
      "capability_id": "voice.command",
      "grade": "insufficient_data",
      "sample_count": 0,
      "success_rate": null,
      "false_trigger_rate": null,
      "latency_p50": null,
      "latency_p90": null,
      "confirmed": false,
      "positive_count": 0,
      "idle_count": 0,
      "registered_recall": null,
      "unknown_false_accept_rate": null,
      "wrong_person_count": 0,
      "claim_level": "mainline",
      "risk_role": "convenience",
      "depth": "deep",
      "dependency_role": "trigger",
      "brain_allowed": false
    },
    "voice.stop": {
      "capability_id": "voice.stop",
      "grade": "insufficient_data",
      "sample_count": 0,
      "success_rate": null,
      "false_trigger_rate": null,
      "latency_p50": null,
      "latency_p90": null,
      "confirmed": false,
      "positive_count": 0,
      "idle_count": 0,
      "registered_recall": null,
      "unknown_false_accept_rate": null,
      "wrong_person_count": 0,
      "claim_level": "mainline",
      "risk_role": "convenience",
      "depth": "deep",
      "dependency_role": "trigger",
      "brain_allowed": false
    },
    "gesture.wave": {
      "capability_id": "gesture.wave",
      "grade": "insufficient_data",
      "sample_count": 0,
      "success_rate": null,
      "false_trigger_rate": null,
      "latency_p50": null,
      "latency_p90": null,
      "confirmed": false,
      "positive_count": 0,
      "idle_count": 0,
      "registered_recall": null,
      "unknown_false_accept_rate": null,
      "wrong_person_count": 0,
      "claim_level": "mainline",
      "risk_role": "convenience",
      "depth": "deep",
      "dependency_role": "trigger",
      "brain_allowed": false
    },
    "object.cup": {
      "capability_id": "object.cup",
      "grade": "insufficient_data",
      "sample_count": 0,
      "success_rate": null,
      "false_trigger_rate": null,
      "latency_p50": null,
      "latency_p90": null,
      "confirmed": false,
      "positive_count": 0,
      "idle_count": 0,
      "registered_recall": null,
      "unknown_false_accept_rate": null,
      "wrong_person_count": 0,
      "claim_level": "mainline",
      "risk_role": "evidence_only",
      "depth": "deep",
      "dependency_role": "content",
      "brain_allowed": false
    },
    "nav.safe_stop": {
      "capability_id": "nav.safe_stop",
      "grade": "insufficient_data",
      "sample_count": 0,
      "success_rate": null,
      "false_trigger_rate": null,
      "latency_p50": null,
      "latency_p90": null,
      "confirmed": false,
      "positive_count": 0,
      "idle_count": 0,
      "registered_recall": null,
      "unknown_false_accept_rate": null,
      "wrong_person_count": 0,
      "claim_level": "mainline",
      "risk_role": "safety_critical",
      "depth": "deep",
      "dependency_role": "safety_guard",
      "brain_allowed": false
    },
    "nav.no_auto_resume": {
      "capability_id": "nav.no_auto_resume",
      "grade": "insufficient_data",
      "sample_count": 0,
      "success_rate": null,
      "false_trigger_rate": null,
      "latency_p50": null,
      "latency_p90": null,
      "confirmed": false,
      "positive_count": 0,
      "idle_count": 0,
      "registered_recall": null,
      "unknown_false_accept_rate": null,
      "wrong_person_count": 0,
      "claim_level": "mainline",
      "risk_role": "safety_critical",
      "depth": "deep",
      "dependency_role": "safety_guard",
      "brain_allowed": false
    },
    "nav.short_move": {
      "capability_id": "nav.short_move",
      "grade": "insufficient_data",
      "sample_count": 0,
      "success_rate": null,
      "false_trigger_rate": null,
      "latency_p50": null,
      "latency_p90": null,
      "confirmed": false,
      "positive_count": 0,
      "idle_count": 0,
      "registered_recall": null,
      "unknown_false_accept_rate": null,
      "wrong_person_count": 0,
      "claim_level": "mainline",
      "risk_role": "actuation",
      "depth": "deep",
      "dependency_role": "actuation",
      "brain_allowed": false
    },
    "nav.dynamic_avoidance": {
      "capability_id": "nav.dynamic_avoidance",
      "grade": "insufficient_data",
      "sample_count": 0,
      "success_rate": null,
      "false_trigger_rate": null,
      "latency_p50": null,
      "latency_p90": null,
      "confirmed": false,
      "positive_count": 0,
      "idle_count": 0,
      "registered_recall": null,
      "unknown_false_accept_rate": null,
      "wrong_person_count": 0,
      "claim_level": "future",
      "risk_role": "actuation",
      "depth": "future",
      "dependency_role": "actuation",
      "brain_allowed": false
    },
    "pose.basic": {
      "capability_id": "pose.basic",
      "grade": "insufficient_data",
      "sample_count": 0,
      "success_rate": null,
      "false_trigger_rate": null,
      "latency_p50": null,
      "latency_p90": null,
      "confirmed": false,
      "positive_count": 0,
      "idle_count": 0,
      "registered_recall": null,
      "unknown_false_accept_rate": null,
      "wrong_person_count": 0,
      "claim_level": "studio_only",
      "risk_role": "evidence_only",
      "depth": "thin",
      "dependency_role": "content",
      "brain_allowed": false
    },
    "pose.fall": {
      "capability_id": "pose.fall",
      "grade": "insufficient_data",
      "sample_count": 0,
      "success_rate": null,
      "false_trigger_rate": null,
      "latency_p50": null,
      "latency_p90": null,
      "confirmed": false,
      "positive_count": 0,
      "idle_count": 0,
      "registered_recall": null,
      "unknown_false_accept_rate": null,
      "wrong_person_count": 0,
      "claim_level": "future",
      "risk_role": "evidence_only",
      "depth": "future",
      "dependency_role": "evidence",
      "brain_allowed": false
    },
    "brain.skill_gate": {
      "capability_id": "brain.skill_gate",
      "grade": "insufficient_data",
      "sample_count": 0,
      "success_rate": null,
      "false_trigger_rate": null,
      "latency_p50": null,
      "latency_p90": null,
      "confirmed": false,
      "positive_count": 0,
      "idle_count": 0,
      "registered_recall": null,
      "unknown_false_accept_rate": null,
      "wrong_person_count": 0,
      "claim_level": "mainline",
      "risk_role": "safety_critical",
      "depth": "deep",
      "dependency_role": "safety_guard",
      "brain_allowed": false
    },
    "brain.trace": {
      "capability_id": "brain.trace",
      "grade": "insufficient_data",
      "sample_count": 0,
      "success_rate": null,
      "false_trigger_rate": null,
      "latency_p50": null,
      "latency_p90": null,
      "confirmed": false,
      "positive_count": 0,
      "idle_count": 0,
      "registered_recall": null,
      "unknown_false_accept_rate": null,
      "wrong_person_count": 0,
      "claim_level": "mainline",
      "risk_role": "evidence_only",
      "depth": "deep",
      "dependency_role": "evidence",
      "brain_allowed": false
    },
    "studio.evidence": {
      "capability_id": "studio.evidence",
      "grade": "insufficient_data",
      "sample_count": 0,
      "success_rate": null,
      "false_trigger_rate": null,
      "latency_p50": null,
      "latency_p90": null,
      "confirmed": false,
      "positive_count": 0,
      "idle_count": 0,
      "registered_recall": null,
      "unknown_false_accept_rate": null,
      "wrong_person_count": 0,
      "claim_level": "mainline",
      "risk_role": "evidence_only",
      "depth": "deep",
      "dependency_role": "evidence",
      "brain_allowed": false
    },
    "cli.readiness": {
      "capability_id": "cli.readiness",
      "grade": "insufficient_data",
      "sample_count": 0,
      "success_rate": null,
      "false_trigger_rate": null,
      "latency_p50": null,
      "latency_p90": null,
      "confirmed": false,
      "positive_count": 0,
      "idle_count": 0,
      "registered_recall": null,
      "unknown_false_accept_rate": null,
      "wrong_person_count": 0,
      "claim_level": "not_claimed",
      "risk_role": "safety_support",
      "depth": "thin",
      "dependency_role": "evidence",
      "brain_allowed": false
    }
  }
}